<?xml version="1.0" encoding="UTF-8"?>
<xs:schema attributeFormDefault="unqualified" elementFormDefault="qualified" xmlns:xs="http://www.w3.org/2001/XMLSchema">
	<xs:element name="list">
		<xs:complexType>
			<xs:sequence>
				<xs:element name="parameters">
					<xs:complexType>
						<xs:sequence>
							<xs:element name="param" maxOccurs="unbounded" minOccurs="0">
								<xs:complexType>
									<xs:simpleContent>
										<xs:extension base="xs:string">
											<xs:attribute type="xs:string" name="name" use="optional" />
											<xs:attribute type="xs:string" name="value" use="optional" />
										</xs:extension>
									</xs:simpleContent>
								</xs:complexType>
							</xs:element>
						</xs:sequence>
					</xs:complexType>
				</xs:element>
				<xs:element name="reward" maxOccurs="unbounded" minOccurs="0">
					<xs:complexType>
						<xs:sequence>
							<xs:element name="items">
								<xs:complexType>
									<xs:sequence>
										<xs:element name="item" maxOccurs="unbounded" minOccurs="0">
											<xs:complexType>
												<xs:simpleContent>
													<xs:extension base="xs:string">
														<xs:attribute type="xs:int" name="id" use="optional" />
														<xs:attribute type="xs:long" name="count" use="optional" />
														<xs:attribute type="xs:double" name="chance" use="optional" />
														<xs:attribute type="xs:double" name="lotteryChance" use="optional" />
														<xs:attribute type="xs:int" name="enchant" use="optional" />
														<xs:attribute type="xs:boolean" name="redeemInAnyCase" use="optional" />
													</xs:extension>
												</xs:simpleContent>
											</xs:complexType>
										</xs:element>
									</xs:sequence>
								</xs:complexType>
							</xs:element>
						</xs:sequence>
						<xs:attribute type="xs:byte" name="from" use="optional" />
						<xs:attribute type="xs:byte" name="to" use="optional" />
					</xs:complexType>
				</xs:element>
			</xs:sequence>
		</xs:complexType>
	</xs:element>
</xs:schema>